Page,Pageviews
Breast Cancer Signs to be Aware Of - MIRIAM BELLO,6611
An Interconnected Healthcare Continuum Drives Better Care – EC,4444
Ivermectin: Controversial COVID-19 Drug Used in Mexico City - JORGE RAMOS ZWANZIGER,4166
Potential Surpasses Challenges in Deepwater - PEDRO ALCALÁ,2504
Cultural Intelligence a Cornerstone of Pharma Innovation – EC,2295
Fast-Food Industry Continues to Grow in Mexico - ALESSA FLORES,2084
The Ponzi Schemes Right Before Our Eyes – SC,1467
Mexico’s Highest-Paying Jobs in 2021 - MBN STAFF,1410
How the Russia-Mexico Relationship is Breaking New Ground - ALESSA FLORES,1266
Who Were the Most Active VCs in Spanish-Speaking Latam Fintechs? - SC,1199
Why Scaling Up is Like A $50 Cup of Coffee – SC,1139
Eni Grows Big - PETER APPLEBY,1086
Schlumberger: 85 Years of Operational Excellence in Mexico – MBN STAFF,1077
Your Unlived Life – SC,1026
A New Holiday Season for Retailers After COVID-19 - SOFÍA HANNA,1002
Reimagining the Pharma Sales Rep Model – EC,938
The Moment Is Right For FPSOs In Mexico -PEDRO ALCALÁ,917
Chronic Obesity Treatment Gains FDA Approval - MIRIAM BELLO,909
The Role of Fintech in Financial Inclusion in Mexico – SC,845
Chihuahua: Capital of the World for Electrical Wiring - SOFÍA HANNA,833
Natural Gas Storage Remains on the To-Do List - CAS BIEKMANN,809
What Is the Potential of Mexico’s Lithium Reserves? - PALOMA DURAN,808
A Unique Deepwater Project Moves Forward - PEDRO ALCALÁ,798
How Digital Transformation Will Impact the AEC Industry – EC,768
,555016
